{
  "schema": "urn:eatf:spec:aep:metadata:1.0",
  "attestation_id": "att_toolkit_roundtrip_01",
  "created_at": "2026-07-25T12:00:00Z",
  "agent_id": "urn:eatf:tenant:demo:agent:roundtrip",
  "action_type": "foundational:aep-response",
  "policy_id": "atap-basic",
  "policy_version": "1.0",
  "policy_coverage": 1.0,
  "policy_decision": "allow",
  "format_version": "AEP-1.0"
}
